{
  "reference_manifest_version": "1.0",
  "agent": "CMMC 2.0",
  "last_verified": "2025-11-05",
  "sources": [
    {
      "id": "cmmc_home",
      "title": "CMMC 2.0 Official Site",
      "url": "https://dodcio.defense.gov/CMMC/",
      "type": "program",
      "scope": ["model", "assessment-guides", "scoping"],
      "stability": "changing"
    },
    {
      "id": "nist_800_171_r3",
      "title": "NIST SP 800-171 Rev.3",
      "url": "https://csrc.nist.gov/publications/detail/sp/800-171/rev-3/final",
      "type": "standard",
      "scope": ["cui-protections", "derived-requirements"],
      "stability": "stable"
    },
    {
      "id": "dfars_7012",
      "title": "DFARS 252.204-7012 (CUI Safeguarding)",
      "url": "https://www.acquisition.gov/dfars/252.204-7012-safeguarding-covered-defense-information-and-cyber-incident-reporting",
      "type": "regulation",
      "scope": ["contractual", "reporting"],
      "stability": "stable"
    },
    {
      "id": "cmmc_scoring",
      "title": "CMMC/SPRScoring Resources",
      "url": "https://www.project-spectrum.io/",
      "type": "guidance",
      "scope": ["sprs-scoring", "self-assessment"],
      "stability": "changing"
    }
  ]
}