{
  "reference_manifest_version": "1.0",
  "agent": "Market Intelligence",
  "last_verified": "2025-11-05",
  "sources": [
    {
      "id": "sec_edgar",
      "title": "SEC EDGAR Company Filings",
      "url": "https://www.sec.gov/edgar/search/",
      "type": "regulator",
      "scope": ["10-k","10-q","8-k"],
      "stability": "changing"
    },
    {
      "id": "company_newsrooms",
      "title": "Official Company Newsrooms (generic entry)",
      "url": "https://www.google.com/search?q=%5Bcompany%5D+press+room",
      "type": "primary",
      "scope": ["press-releases","updates"],
      "stability": "changing",
      "notes": "Replace with specific vendors' newsroom URLs in your allowlist."
    },
    {
      "id": "census_bls",
      "title": "BLS Economic Data",
      "url": "https://www.bls.gov/data/",
      "type": "gov-data",
      "scope": ["employment","wages","indices"],
      "stability": "changing"
    },
    {
      "id": "bea",
      "title": "BEA — National Economic Accounts",
      "url": "https://www.bea.gov/",
      "type": "gov-data",
      "scope": ["gdp","industry","trade"],
      "stability": "changing"
    },
    {
      "id": "eu_eurostat",
      "title": "Eurostat",
      "url": "https://ec.europa.eu/eurostat/",
      "type": "gov-data",
      "scope": ["eu-statistics"],
      "stability": "changing"
    },
    {
      "id": "cisa",
      "title": "CISA News & Alerts",
      "url": "https://www.cisa.gov/news-events",
      "type": "gov",
      "scope": ["sector-updates","critical-infrastructure"],
      "stability": "changing"
    }
  ]
}