{
  "reference_manifest_version": "1.0",
  "agent": "Partnership Development",
  "last_verified": "2025-11-05",
  "sources": [
    {
      "id": "ms_partner_center",
      "title": "Microsoft Partner Center",
      "url": "https://partner.microsoft.com/",
      "type": "program",
      "scope": ["enrollment","benefits","co-sell"],
      "stability": "changing"
    },
    {
      "id": "azure_marketplace",
      "title": "Microsoft Azure Marketplace",
      "url": "https://azuremarketplace.microsoft.com/",
      "type": "catalog",
      "scope": ["listings","gtm-benefits"],
      "stability": "changing"
    },
    {
      "id": "aws_partner_network",
      "title": "AWS Partner Network",
      "url": "https://aws.amazon.com/partners/",
      "type": "program",
      "scope": ["tiers","co-marketing","marketplace"],
      "stability": "changing"
    },
    {
      "id": "google_cloud_partners",
      "title": "Google Cloud Partner Advantage",
      "url": "https://cloud.google.com/partners",
      "type": "program",
      "scope": ["programs","specializations"],
      "stability": "changing"
    },
    {
      "id": "snowflake_partners",
      "title": "Snowflake Partner Network",
      "url": "https://www.snowflake.com/partners/",
      "type": "program",
      "scope": ["isv","data-sharing","co-sell"],
      "stability": "changing"
    },
    {
      "id": "databricks_partners",
      "title": "Databricks Partner Program",
      "url": "https://www.databricks.com/partners",
      "type": "program",
      "scope": ["lakehouse-ecosystem","co-sell"],
      "stability": "changing"
    },
    {
      "id": "saastr_partnerships",
      "title": "SaaStr — Partnerships & Channel",
      "url": "https://www.saastr.com/blog/",
      "type": "best-practice",
      "scope": ["channel","alliances","pricing"],
      "stability": "changing",
      "notes": "Use posts focused on partnerships/GTM."
    },
    {
      "id": "openview_partnerships",
      "title": "OpenView — Partnerships/PLG",
      "url": "https://openviewpartners.com/blog/",
      "type": "best-practice",
      "scope": ["ecosystems","plg-partners","pricing"],
      "stability": "changing"
    },
    {
      "id": "hbr_platforms",
      "title": "Harvard Business Review (public) — Platform & Ecosystems",
      "url": "https://hbr.org/topic/platforms",
      "type": "best-practice",
      "scope": ["network-effects","alliances"],
      "stability": "changing",
      "notes": "Use public/ungated content only."
    }
  ]
}