{
  "reference_manifest_version": "1.0",
  "agent": "Government Contract Specialist",
  "last_verified": "2025-11-05",
  "sources": [
    {
      "id": "acquisition_gov",
      "title": "Acquisition.gov (FAR/DFARS)",
      "url": "https://www.acquisition.gov/",
      "type": "regulation",
      "scope": ["far","dfars","clauses","provisions"],
      "stability": "changing"
    },
    {
      "id": "sam_gov",
      "title": "SAM.gov",
      "url": "https://sam.gov/",
      "type": "portal",
      "scope": ["solicitations","awards","entity-registration"],
      "stability": "changing"
    },
    {
      "id": "dod_cio_cmmc",
      "title": "DoD CIO — CMMC",
      "url": "https://dodcio.defense.gov/CMMC/",
      "type": "program",
      "scope": ["model","assessment-guides","policy"],
      "stability": "changing"
    },
    {
      "id": "gao_bid_protests",
      "title": "GAO — Bid Protest Docket & Decisions",
      "url": "https://www.gao.gov/legal/bid-protests",
      "type": "decisions",
      "scope": ["precedent","interpretation"],
      "stability": "changing"
    },
    {
      "id": "daU",
      "title": "Defense Acquisition University (DAU)",
      "url": "https://www.dau.edu/",
      "type": "guidance",
      "scope": ["training","handbooks"],
      "stability": "changing"
    }
  ]
}