{
  "reference_manifest_version": "1.0",
  "agent": "Customer Insights",
  "last_verified": "2025-11-05",
  "sources": [
    {
      "id": "forrester_public",
      "title": "Forrester (Public Research Pages)",
      "url": "https://www.forrester.com/blogs/",
      "type": "analyst",
      "scope": ["cx-insights","trends"],
      "stability": "changing",
      "notes": "Use public posts only."
    },
    {
      "id": "gartner_public",
      "title": "Gartner (Public Articles)",
      "url": "https://www.gartner.com/en/insights",
      "type": "analyst",
      "scope": ["cx","market-trends"],
      "stability": "changing",
      "notes": "Public content only."
    },
    {
      "id": "nps_bain",
      "title": "Bain — NPS Overview",
      "url": "https://www.netpromotersystem.com/about/",
      "type": "guidance",
      "scope": ["nps-methodology"],
      "stability": "stable"
    },
    {
      "id": "cxl",
      "title": "CXL (Public Articles)",
      "url": "https://cxl.com/blog/",
      "type": "guidance",
      "scope": ["cx","experimentation"],
      "stability": "changing"
    },
    {
      "id": "privacy_regulators",
      "title": "Privacy Regulators (for survey/data rules)",
      "url": "https://ico.org.uk/",
      "type": "regulator",
      "scope": ["survey-privacy","consent"],
      "stability": "changing",
      "notes": "Add CPPA/HHS as needed."
    }
  ]
}