{
  "reference_manifest_version": "1.0",
  "agent": "Orchestration / PMO",
  "last_verified": "2025-11-05",
  "sources": [
    {
      "id": "pmi_pmbok",
      "title": "PMI — PMBOK (Public Summaries)",
      "url": "https://www.pmi.org/pmbok-guide-standards",
      "type": "framework",
      "scope": ["process-groups","knowledge-areas"],
      "stability": "stable"
    },
    {
      "id": "prince2",
      "title": "PRINCE2 (Official Overview)",
      "url": "https://www.axelos.com/certifications/prince2",
      "type": "framework",
      "scope": ["governance","stages","controls"],
      "stability": "stable"
    },
    {
      "id": "kanban_university",
      "title": "Kanban University — Guides",
      "url": "https://resources.kanban.university/",
      "type": "framework",
      "scope": ["flow","wip-limits","cadence"],
      "stability": "changing"
    },
    {
      "id": "azure_boards",
      "title": "Azure Boards",
      "url": "https://learn.microsoft.com/azure/devops/boards/",
      "type": "tool-docs",
      "scope": ["work-items","delivery-plans","reporting"],
      "stability": "changing"
    },
    {
      "id": "jira_docs",
      "title": "Jira Software Documentation",
      "url": "https://support.atlassian.com/jira-software-cloud/",
      "type": "tool-docs",
      "scope": ["workflows","boards","automation"],
      "stability": "changing"
    }
  ]
}