{
  "reference_manifest_version": "1.0",
  "agent": "Compliance Control Mapper",
  "last_verified": "2025-11-05",
  "sources": [
    {
      "id": "oscal",
      "title": "NIST OSCAL (Catalogs, Profiles, Mappings)",
      "url": "https://pages.nist.gov/OSCAL/",
      "type": "schema",
      "scope": ["machine-readable-controls", "crosswalks"],
      "stability": "changing"
    },
    {
      "id": "nist_800_53_r5",
      "title": "NIST SP 800-53 Rev.5 (Canonical Spine)",
      "url": "https://csrc.nist.gov/publications/detail/sp/800-53/rev-5/final",
      "type": "standard",
      "scope": ["controls", "parameters", "enhancements"],
      "stability": "stable"
    },
    {
      "id": "nist_800_171_r3",
      "title": "NIST SP 800-171 Rev.3",
      "url": "https://csrc.nist.gov/publications/detail/sp/800-171/rev-3/final",
      "type": "standard",
      "scope": ["cui-requirements"],
      "stability": "stable"
    },
    {
      "id": "cisa_framework_crosswalk",
      "title": "CISA Framework Crosswalks",
      "url": "https://www.cisa.gov/resources-tools/resources/cybersecurity-framework-crosswalk",
      "type": "mapping",
      "scope": ["csf↔800-53↔iso↔cis"],
      "stability": "stable"
    },
    {
      "id": "cis_controls_v8",
      "title": "CIS Controls v8",
      "url": "https://www.cisecurity.org/controls/v8",
      "type": "standard",
      "scope": ["safeguards", "ig1-ig3"],
      "stability": "stable"
    },
    {
      "id": "iso_27001_overview",
      "title": "ISO/IEC 27001:2022 (Overview)",
      "url": "https://www.iso.org/standard/27001",
      "type": "standard",
      "scope": ["annex-a-overview"],
      "stability": "stable",
      "notes": "Use for references only; full text is licensed."
    },
    {
      "id": "nist_csf_2_0",
      "title": "NIST CSF 2.0",
      "url": "https://www.nist.gov/cyberframework",
      "type": "standard",
      "scope": ["functions", "categories", "subcategories"],
      "stability": "stable"
    },
    {
      "id": "fedramp_baselines",
      "title": "FedRAMP Baselines",
      "url": "https://www.fedramp.gov/",
      "type": "program",
      "scope": ["baselines", "parameters"],
      "stability": "changing"
    }
  ]
}