{
  "reference_manifest_version": "1.0",
  "agent": "General Counsel",
  "last_verified": "2025-11-05",
  "sources": [
    {
      "id": "law_cornell",
      "title": "Legal Information Institute (Cornell)",
      "url": "https://www.law.cornell.edu/",
      "type": "reference",
      "scope": ["statutes","regs","definitions"],
      "stability": "stable"
    },
    {
      "id": "govinfo",
      "title": "govinfo (GPO)",
      "url": "https://www.govinfo.gov/",
      "type": "official",
      "scope": ["usc","cfr","federal-register"],
      "stability": "stable"
    },
    {
      "id": "acquisition_gov",
      "title": "Acquisition.gov (FAR/DFARS)",
      "url": "https://www.acquisition.gov/",
      "type": "regulation",
      "scope": ["far","dfars","clauses"],
      "stability": "changing"
    },
    {
      "id": "sec_rulemaking",
      "title": "SEC — Rulemaking & Guidance",
      "url": "https://www.sec.gov/rules",
      "type": "regulator",
      "scope": ["rules","interpretations"],
      "stability": "changing"
    },
    {
      "id": "doj_antitrust",
      "title": "DOJ Antitrust Division",
      "url": "https://www.justice.gov/atr",
      "type": "regulator",
      "scope": ["guidance","enforcement"],
      "stability": "changing"
    },
    {
      "id": "ftc_competition",
      "title": "FTC Competition & Consumer Protection",
      "url": "https://www.ftc.gov/",
      "type": "regulator",
      "scope": ["rules","guidance","enforcement"],
      "stability": "changing"
    },
    {
      "id": "uspto",
      "title": "USPTO",
      "url": "https://www.uspto.gov/",
      "type": "office",
      "scope": ["patents","trademarks"],
      "stability": "changing"
    }
  ]
}