{
  "reference_manifest_version": "1.0",
  "agent": "CFO",
  "last_verified": "2025-11-05",
  "sources": [
    {
      "id": "fasb_overview",
      "title": "FASB — Standards (Overview/Public)",
      "url": "https://www.fasb.org/",
      "type": "standards",
      "scope": ["asc-overviews","updates"],
      "stability": "changing"
    },
    {
      "id": "ifrs",
      "title": "IFRS (Public Summaries)",
      "url": "https://www.ifrs.org/issued-standards/list-of-standards/",
      "type": "standards",
      "scope": ["international"],
      "stability": "changing"
    },
    {
      "id": "irs_business",
      "title": "IRS — Business Tax Resources",
      "url": "https://www.irs.gov/businesses",
      "type": "regulator",
      "scope": ["tax","credits","deductions"],
      "stability": "changing"
    },
    {
      "id": "bvp_state_of_cloud",
      "title": "Bessemer — State of the Cloud (Public)",
      "url": "https://www.bvp.com/atlas/state-of-the-cloud",
      "type": "benchmark",
      "scope": ["saas-metrics","benchmarks"],
      "stability": "changing"
    },
    {
      "id": "pwise_pricing",
      "title": "ProfitWell/Price Intelligently (Public)",
      "url": "https://www.priceintelligently.com/blog",
      "type": "best-practice",
      "scope": ["pricing","retention"],
      "stability": "changing"
    }
  ]
}