{
  "reference_manifest_version": "1.0",
  "agent": "CISO",
  "last_verified": "2025-11-05",
  "sources": [
    {
      "id": "nist_csrc",
      "title": "NIST CSRC (Primary Publications Portal)",
      "url": "https://csrc.nist.gov/publications",
      "type": "standard",
      "scope": ["frameworks","controls","guidance"],
      "stability": "stable"
    },
    {
      "id": "nist_800_53_r5",
      "title": "NIST SP 800-53 Rev.5",
      "url": "https://csrc.nist.gov/publications/detail/sp/800-53/rev-5/final",
      "type": "standard",
      "scope": ["controls","parameters","enhancements"],
      "stability": "stable"
    },
    {
      "id": "nist_csf_2_0",
      "title": "NIST Cybersecurity Framework 2.0",
      "url": "https://www.nist.gov/cyberframework",
      "type": "standard",
      "scope": ["functions","categories","subcategories"],
      "stability": "stable"
    },
    {
      "id": "cisa_home",
      "title": "CISA (Advisories & Guidance)",
      "url": "https://www.cisa.gov/",
      "type": "advisory",
      "scope": ["alerts","kev","guidance","cpg"],
      "stability": "changing"
    },
    {
      "id": "cisa_kev",
      "title": "CISA Known Exploited Vulnerabilities",
      "url": "https://www.cisa.gov/known-exploited-vulnerabilities-catalog",
      "type": "advisory",
      "scope": ["exploited-cves","prioritization"],
      "stability": "changing"
    },
    {
      "id": "mitre_attack",
      "title": "MITRE ATT&CK (Enterprise)",
      "url": "https://attack.mitre.org/matrices/enterprise/",
      "type": "catalog",
      "scope": ["tactics","techniques","procedures"],
      "stability": "changing"
    },
    {
      "id": "cis_controls_v8",
      "title": "CIS Critical Security Controls v8",
      "url": "https://www.cisecurity.org/controls/v8",
      "type": "standard",
      "scope": ["safeguards","ig1-ig3"],
      "stability": "stable"
    },
    {
      "id": "iso_27001_overview",
      "title": "ISO/IEC 27001:2022 (Overview)",
      "url": "https://www.iso.org/standard/27001",
      "type": "standard",
      "scope": ["requirements-overview","annex-a-overview"],
      "stability": "stable",
      "notes": "Do not reproduce licensed text; summarize only."
    },
    {
      "id": "msft_waf_security",
      "title": "Azure Well-Architected Framework — Security",
      "url": "https://learn.microsoft.com/azure/well-architected/security/",
      "type": "guidance",
      "scope": ["cloud-security","best-practices"],
      "stability": "changing"
    },
    {
      "id": "ms_defender_docs",
      "title": "Microsoft Defender for Cloud Docs",
      "url": "https://learn.microsoft.com/azure/defender-for-cloud/",
      "type": "guidance",
      "scope": ["cloud-posture","recommendations"],
      "stability": "changing"
    }
  ]
}