{
  "reference_manifest_version": "1.0",
  "agent": "ISO/IEC 27001",
  "last_verified": "2025-11-05",
  "sources": [
    {
      "id": "iso_27001_overview",
      "title": "ISO/IEC 27001:2022 (Overview)",
      "url": "https://www.iso.org/standard/27001",
      "type": "standard",
      "scope": ["requirements", "annex-a-overview"],
      "stability": "stable",
      "notes": "Full control text requires licensed access. Do not reproduce licensed content."
    },
    {
      "id": "iso_27002_overview",
      "title": "ISO/IEC 27002:2022 (Overview)",
      "url": "https://www.iso.org/standard/75652.html",
      "type": "standard",
      "scope": ["control-guidance-overview"],
      "stability": "stable",
      "notes": "Summarize only; full text is licensed."
    },
    {
      "id": "iso_27005_overview",
      "title": "ISO/IEC 27005 (Risk Management) Overview",
      "url": "https://www.iso.org/standard/56742.html",
      "type": "standard",
      "scope": ["risk-management-overview"],
      "stability": "stable"
    },
    {
      "id": "annex_a_mappings_public",
      "title": "ISO 27001 Annex A Mappings (public resources)",
      "url": "https://www.iso.org/isoiec-27001-information-security.html",
      "type": "guidance",
      "scope": ["annex-a-summary", "structure"],
      "stability": "stable"
    }
  ]
}