{
  "reference_manifest_version": "1.0",
  "agent": "Threat Modeling + Control Correlation",
  "last_verified": "2025-11-05",
  "sources": [
    {
      "id": "nist_800_154",
      "title": "NIST SP 800-154 (Guide to Data-Centric Threat Modeling)",
      "url": "https://csrc.nist.gov/publications/detail/sp/800-154/ipd/final",
      "type": "standard",
      "scope": ["threat-modeling", "data-centric"],
      "stability": "stable"
    },
    {
      "id": "nist_800_30_r1",
      "title": "NIST SP 800-30 Rev.1 (Risk Assessment Guide)",
      "url": "https://csrc.nist.gov/publications/detail/sp/800-30/rev-1/final",
      "type": "standard",
      "scope": ["risk-assessment", "methodology"],
      "stability": "stable"
    },
    {
      "id": "owasp_tm_manifesto",
      "title": "OWASP Threat Modeling Manifesto",
      "url": "https://www.threatmodelingmanifesto.org/",
      "type": "guidance",
      "scope": ["principles", "anti-patterns"],
      "stability": "stable"
    },
    {
      "id": "mitre_attack",
      "title": "MITRE ATT&CK (Enterprise Matrix)",
      "url": "https://attack.mitre.org/matrices/enterprise/",
      "type": "catalog",
      "scope": ["tactics", "techniques", "procedures"],
      "stability": "changing",
      "notes": "Use for technique mapping and attack-path reasoning."
    },
    {
      "id": "mitre_d3fend",
      "title": "MITRE D3FEND",
      "url": "https://d3fend.mitre.org/",
      "type": "catalog",
      "scope": ["defensive-techniques", "mitigation-mapping"],
      "stability": "changing"
    },
    {
      "id": "cisa_kev",
      "title": "CISA Known Exploited Vulnerabilities (KEV)",
      "url": "https://www.cisa.gov/known-exploited-vulnerabilities-catalog",
      "type": "advisory",
      "scope": ["exploited-cves", "prioritization"],
      "stability": "changing"
    },
    {
      "id": "owasp_asvs",
      "title": "OWASP ASVS",
      "url": "https://owasp.org/www-project-application-security-verification-standard/",
      "type": "standard",
      "scope": ["appsec-requirements", "testing"],
      "stability": "stable"
    },
    {
      "id": "py_tm",
      "title": "PyTM (Threat Model as Code)",
      "url": "https://pytm.readthedocs.io/",
      "type": "tool-docs",
      "scope": ["tmac", "syntax", "examples"],
      "stability": "stable"
    },
    {
      "id": "o_tm",
      "title": "Open Threat Model (OTM)",
      "url": "https://github.com/iriusrisk/OpenThreatModel",
      "type": "spec",
      "scope": ["tmac", "schema"],
      "stability": "stable"
    },
    {
      "id": "nist_800_207",
      "title": "NIST SP 800-207 (Zero Trust Architecture)",
      "url": "https://csrc.nist.gov/publications/detail/sp/800-207/final",
      "type": "standard",
      "scope": ["zta", "architecture"],
      "stability": "stable"
    }
  ]
}