{
  "reference_manifest_version": "1.0",
  "agent": "CEO Strategy",
  "last_verified": "2025-11-05",
  "sources": [
    {
      "id": "hbr_strategy",
      "title": "Harvard Business Review — Strategy (Public)",
      "url": "https://hbr.org/topic/strategy",
      "type": "best-practice",
      "scope": ["competitive-advantage","focus","tradeoffs"],
      "stability": "changing"
    },
    {
      "id": "mck_strategy",
      "title": "McKinsey — Strategy & Corporate Finance (Public)",
      "url": "https://www.mckinsey.com/capabilities/strategy-and-corporate-finance/our-insights",
      "type": "analyst",
      "scope": ["portfolios","cap-allocation","resilience"],
      "stability": "changing"
    },
    {
      "id": "bcg_insights",
      "title": "BCG — Insights (Public)",
      "url": "https://www.bcg.com/insights",
      "type": "analyst",
      "scope": ["growth","transformation","platforms"],
      "stability": "changing"
    },
    {
      "id": "a16z",
      "title": "a16z — Essays (Public)",
      "url": "https://a16z.com/topics/",
      "type": "best-practice",
      "scope": ["market-structure","platforms","pricing"],
      "stability": "changing"
    }
  ]
}