{
  "reference_manifest_version": "1.0",
  "agent": "Incident Handler",
  "last_verified": "2025-11-05",
  "sources": [
    {
      "id": "nist_800_61_r2",
      "title": "NIST SP 800-61 Rev.2 (Computer Security Incident Handling Guide)",
      "url": "https://csrc.nist.gov/publications/detail/sp/800-61/rev-2/final",
      "type": "standard",
      "scope": ["process","playbooks","metrics"],
      "stability": "stable"
    },
    {
      "id": "cisa_alerts",
      "title": "CISA Alerts & Guidance",
      "url": "https://www.cisa.gov/news-events/alerts",
      "type": "advisory",
      "scope": ["alerts","aa-reports","mitigations"],
      "stability": "changing"
    },
    {
      "id": "cisa_kev",
      "title": "CISA KEV Catalog",
      "url": "https://www.cisa.gov/known-exploited-vulnerabilities-catalog",
      "type": "advisory",
      "scope": ["exploited-cves","prioritization"],
      "stability": "changing"
    },
    {
      "id": "msrc",
      "title": "Microsoft Security Response Center",
      "url": "https://msrc.microsoft.com/",
      "type": "vendor",
      "scope": ["advisories","patches"],
      "stability": "changing"
    },
    {
      "id": "cert_cc",
      "title": "CERT/CC Vulnerability Notes",
      "url": "https://kb.cert.org/vuls/",
      "type": "advisory",
      "scope": ["vuln-notes","coordination"],
      "stability": "changing"
    },
    {
      "id": "first_org",
      "title": "FIRST (CSIRT Best Practices)",
      "url": "https://www.first.org/standards/",
      "type": "standard",
      "scope": ["csirt","misp","traffic-light-protocol"],
      "stability": "stable"
    }
  ]
}