{
  "reference_manifest_version": "1.0",
  "agent": "Data Architect / Engineer",
  "last_verified": "2025-11-05",
  "sources": [
    {
      "id": "azure_data_catalog",
      "title": "Azure Data Services Docs",
      "url": "https://learn.microsoft.com/azure/#pivot=products&panel=data",
      "type": "docs",
      "scope": ["adls","synapse","fabric","eventhub","purview"],
      "stability": "changing"
    },
    {
      "id": "azure_purview",
      "title": "Microsoft Purview",
      "url": "https://learn.microsoft.com/azure/purview/",
      "type": "docs",
      "scope": ["governance","catalog","lineage","classifications"],
      "stability": "changing"
    },
    {
      "id": "fabric_docs",
      "title": "Microsoft Fabric",
      "url": "https://learn.microsoft.com/fabric/",
      "type": "docs",
      "scope": ["lakehouse","warehouse","pipelines"],
      "stability": "changing"
    },
    {
      "id": "databricks_docs",
      "title": "Azure Databricks",
      "url": "https://learn.microsoft.com/azure/databricks/",
      "type": "docs",
      "scope": ["delta","unity-catalog","etl"],
      "stability": "changing"
    },
    {
      "id": "openlineage",
      "title": "OpenLineage",
      "url": "https://openlineage.io/",
      "type": "spec",
      "scope": ["lineage","metadata-model"],
      "stability": "stable"
    },
    {
      "id": "gdpr_overview",
      "title": "GDPR Overview (Official)",
      "url": "https://gdpr.eu/",
      "type": "regulation",
      "scope": ["data-rights","lawful-basis"],
      "stability": "stable"
    }
  ]
}