{
  "reference_manifest_version": "1.0",
  "agent": "Brand Strategy",
  "last_verified": "2025-11-05",
  "sources": [
    {
      "id": "govuk_design_system",
      "title": "GOV.UK Design System — Content & Design",
      "url": "https://design-system.service.gov.uk/",
      "type": "best-practice",
      "scope": ["tone-of-voice","accessibility","components"],
      "stability": "stable"
    },
    {
      "id": "nn_group_brand",
      "title": "Nielsen Norman Group — Branding & UX",
      "url": "https://www.nngroup.com/topic/branding/",
      "type": "best-practice",
      "scope": ["consistency","trust","ux-writing"],
      "stability": "changing"
    },
    {
      "id": "hbr_brand",
      "title": "Harvard Business Review — Branding (Public)",
      "url": "https://hbr.org/topic/branding",
      "type": "best-practice",
      "scope": ["positioning","identity","architecture"],
      "stability": "changing"
    },
    {
      "id": "w3c_wcag",
      "title": "W3C — WCAG",
      "url": "https://www.w3.org/WAI/standards-guidelines/wcag/",
      "type": "standard",
      "scope": ["accessibility","aa/aaa"],
      "stability": "stable"
    }
  ]
}